fdc_id,data_type,description,food_category_id,publication_date
173193,sr_legacy_food,"Alcoholic Beverage, wine, table, red, Petite Sirah",14,2019/4/1
173194,sr_legacy_food,"Alcoholic Beverage, wine, table, red, Claret",14,2019/4/1
173195,sr_legacy_food,"Alcoholic beverage, wine, table, white, Chenin Blanc",14,2019/4/1
173196,sr_legacy_food,"Alcoholic beverage, wine, table, white, Fume Blanc",14,2019/4/1
173197,sr_legacy_food,"Beverages, Mixed vegetable and fruit juice drink, with added nutrients",14,2019/4/1
173198,sr_legacy_food,"Alcoholic beverage, wine, table, white, Muller Thurgau",14,2019/4/1
173199,sr_legacy_food,"Carbonated beverage, cream soda",14,2019/4/1
173200,sr_legacy_food,"Alcoholic beverage, wine, table, white, Riesling",14,2019/4/1
173201,sr_legacy_food,"Alcoholic beverage, wine, table, white, Sauvignon Blanc",14,2019/4/1
173202,sr_legacy_food,"Alcoholic beverage, wine, table, white, late harvest",14,2019/4/1
173203,sr_legacy_food,"Beverages, carbonated, grape soda",14,2019/4/1
173204,sr_legacy_food,"Beverages, carbonated, low calorie, other than cola or pepper,  without caffeine",14,2019/4/1
173205,sr_legacy_food,"Beverages, carbonated, lemon-lime soda, no caffeine",14,2019/4/1
173206,sr_legacy_food,"Beverages, carbonated, SPRITE, lemon-lime, without caffeine",14,2019/4/1
173207,sr_legacy_food,"Beverages, carbonated, low calorie, other than cola or pepper, with aspartame, contains caffeine",14,2019/4/1
173208,sr_legacy_food,"Alcoholic Beverage, wine, table, red, Burgundy",14,2019/4/1
173209,sr_legacy_food,"Beverages, carbonated, pepper-type, contains caffeine",14,2019/4/1
173210,sr_legacy_food,"Beverages, Energy drink, RED BULL",14,2019/4/1
173211,sr_legacy_food,"Beverages, tea, black, ready to drink, decaffeinated, diet",14,2019/4/1
173212,sr_legacy_food,"Beverages, tea, black, ready to drink, decaffeinated",14,2019/4/1
173213,sr_legacy_food,"Beverages, grape juice drink, canned",14,2019/4/1
173214,sr_legacy_food,"Beverages, Cranberry juice cocktail",14,2019/4/1
173215,sr_legacy_food,"Beverages, SNAPPLE, tea, black and green, ready to drink, peach, diet",14,2019/4/1
173216,sr_legacy_food,"Lemonade, frozen concentrate, white",14,2019/4/1
173217,sr_legacy_food,"Lemonade, frozen concentrate, white, prepared with water",14,2019/4/1
173218,sr_legacy_food,"Beverages, SNAPPLE, tea, black and green, ready to drink, lemon, diet",14,2019/4/1
173219,sr_legacy_food,"Beverages, Malted drink mix, natural, with added nutrients, powder, prepared with whole milk",14,2019/4/1
173220,sr_legacy_food,"Beverages, Malted drink mix, natural, powder, dairy based.",14,2019/4/1
173221,sr_legacy_food,"Beverages, Malted drink mix, natural, powder, prepared with whole milk",14,2019/4/1
173222,sr_legacy_food,"Beverages, OVALTINE, chocolate malt powder",14,2019/4/1
173223,sr_legacy_food,"Beverages, orange and apricot juice drink, canned",14,2019/4/1
173224,sr_legacy_food,"Beverages, pineapple and grapefruit juice drink, canned",14,2019/4/1
173225,sr_legacy_food,"Beverages, pineapple and orange juice drink, canned",14,2019/4/1
173226,sr_legacy_food,"Shake, fast food, vanilla",14,2019/4/1
173227,sr_legacy_food,"Beverages, tea, black, brewed, prepared with tap water",14,2019/4/1
173228,sr_legacy_food,"Beverages, tea, instant, decaffeinated, lemon, diet",14,2019/4/1
173229,sr_legacy_food,"Beverages, tea, instant, decaffeinated, lemon, sweetened",14,2019/4/1
173230,sr_legacy_food,"Beverages, tea, instant, unsweetened, powder",14,2019/4/1
173231,sr_legacy_food,"Beverages, tea, instant, lemon, diet",14,2019/4/1
173232,sr_legacy_food,"Beverages, tea, herb, other than chamomile, brewed",14,2019/4/1
173233,sr_legacy_food,"Beverages, water, bottled, PERRIER",14,2019/4/1
173234,sr_legacy_food,"Beverages, water, bottled, POLAND SPRING",14,2019/4/1
173235,sr_legacy_food,"Beverages, orange-flavor drink, breakfast type, powder",14,2019/4/1
173236,sr_legacy_food,"Beverages, orange-flavor drink, breakfast type, powder, prepared with water",14,2019/4/1
173237,sr_legacy_food,"Beverages, Orange-flavor drink, breakfast type, low calorie, powder",14,2019/4/1
173238,sr_legacy_food,"English muffins, plain, unenriched, without calcium propionate (includes sourdough)",18,2019/4/1
173239,sr_legacy_food,"Pie, apple, commercially prepared, unenriched flour",18,2019/4/1
173240,sr_legacy_food,"Pie, fried pies, cherry",18,2019/4/1
173241,sr_legacy_food,"Tortillas, ready-to-bake or -fry, corn, without added salt",18,2019/4/1
173242,sr_legacy_food,"Tortillas, ready-to-bake or -fry, flour, without added calcium",18,2019/4/1
173243,sr_legacy_food,"Cake, pound, commercially prepared, fat-free",18,2019/4/1
173244,sr_legacy_food,"Cake, yellow, light, dry mix",18,2019/4/1
173245,sr_legacy_food,"Archway Home Style Cookies, Coconut Macaroon",18,2019/4/1
173246,sr_legacy_food,"Archway Home Style Cookies, Date Filled Oatmeal",18,2019/4/1
173247,sr_legacy_food,"Archway Home Style Cookies, Dutch Cocoa",18,2019/4/1
173248,sr_legacy_food,"Archway Home Style Cookies, Frosty Lemon",18,2019/4/1
173249,sr_legacy_food,"Archway Home Style Cookies, Iced Molasses",18,2019/4/1
173250,sr_legacy_food,"Archway Home Style Cookies, Old Fashioned Molasses",18,2019/4/1
173251,sr_legacy_food,"Archway Home Style Cookies, Old Fashioned Windmill Cookies",18,2019/4/1
173252,sr_legacy_food,"Archway Home Style Cookies, Peanut Butter",18,2019/4/1
173253,sr_legacy_food,"Archway Home Style Cookies, Raspberry Filled",18,2019/4/1
173254,sr_legacy_food,"George Weston Bakeries, Brownberry Sage and Onion Stuffing Mix, dry",18,2019/4/1
173255,sr_legacy_food,"Keebler, Keebler Chocolate Graham SELECTS",18,2019/4/1
173256,sr_legacy_food,"Continental Mills, Krusteaz Almond Poppyseed Muffin Mix, Artificially Flavored, dry",18,2019/4/1
173257,sr_legacy_food,"Mckee Baking, Little Debbie Nutty Bars, Wafers with Peanut Butter, Chocolate Covered",18,2019/4/1
173258,sr_legacy_food,"Nabisco, Nabisco Ritz Crackers",18,2019/4/1
173259,sr_legacy_food,"Pillsbury, Buttermilk Biscuits, Artificial Flavor, refrigerated dough",18,2019/4/1
173260,sr_legacy_food,"Pillsbury, Chocolate Chip Cookies, refrigerated dough",18,2019/4/1
173261,sr_legacy_food,"Pillsbury, Crusty French Loaf, refrigerated dough",18,2019/4/1
173262,sr_legacy_food,"Sorghum flour, refined, unenriched",20,2019/4/1
173263,sr_legacy_food,"Rice, brown, parboiled, cooked, UNCLE BENS",20,2019/4/1
173264,sr_legacy_food,"Pasta, gluten-free, rice flour and rice bran extract, cooked, DE BOLES",20,2019/4/1
173265,sr_legacy_food,"Pasta, gluten-free, corn and rice flour, cooked",20,2019/4/1
173266,sr_legacy_food,"Fast foods, biscuit, with egg and bacon",21,2019/4/1
173267,sr_legacy_food,"Fast foods, biscuit, with egg and ham",21,2019/4/1
173268,sr_legacy_food,"Fast foods, biscuit, with crispy chicken fillet",21,2019/4/1
173269,sr_legacy_food,"Fast foods, croissant, with egg, cheese, and bacon",21,2019/4/1
173270,sr_legacy_food,"Fast foods, croissant, with egg, cheese, and ham",21,2019/4/1
173271,sr_legacy_food,"Fast foods, croissant, with egg, cheese, and sausage",21,2019/4/1
173272,sr_legacy_food,"Fast foods, egg, scrambled",21,2019/4/1
173273,sr_legacy_food,"Fast foods, potatoes, hash browns, round pieces or patty",21,2019/4/1
173274,sr_legacy_food,"Fast foods, vanilla, light, soft-serve ice cream, with cone",21,2019/4/1
173275,sr_legacy_food,"Fast foods, sundae, caramel",21,2019/4/1
173276,sr_legacy_food,"Fast foods, sundae, hot fudge",21,2019/4/1
173277,sr_legacy_food,"Fast foods, burrito, with beans and beef",21,2019/4/1
173278,sr_legacy_food,"Fast foods, burrito, with beans, cheese, and beef",21,2019/4/1
173279,sr_legacy_food,"PIZZA HUT 12"" Pepperoni Pizza, Hand-Tossed Crust",21,2019/4/1
173280,sr_legacy_food,"PIZZA HUT 12"" Pepperoni Pizza, Pan Crust",21,2019/4/1
173281,sr_legacy_food,"PIZZA HUT 12"" Super Supreme Pizza, Hand-Tossed Crust",21,2019/4/1
173282,sr_legacy_food,"DOMINO'S 14"" Cheese Pizza, Classic Hand-Tossed Crust",21,2019/4/1
173283,sr_legacy_food,"DOMINO'S 14"" Cheese Pizza, Ultimate Deep Dish Crust",21,2019/4/1
173284,sr_legacy_food,"PAPA JOHN'S 14"" Cheese Pizza, Original Crust",21,2019/4/1
173285,sr_legacy_food,"PAPA JOHN'S 14"" Pepperoni Pizza, Original Crust",21,2019/4/1
173286,sr_legacy_food,"PAPA JOHN'S 14"" The Works Pizza, Original Crust",21,2019/4/1
173287,sr_legacy_food,"PAPA JOHN'S 14"" Cheese Pizza, Thin Crust",21,2019/4/1
173288,sr_legacy_food,"LITTLE CAESARS 14"" Pepperoni Pizza, Large Deep Dish Crust",21,2019/4/1
173289,sr_legacy_food,"LITTLE CAESARS 14"" Cheese Pizza, Thin Crust",21,2019/4/1
173290,sr_legacy_food,"PIZZA HUT 14"" Cheese Pizza, Hand-Tossed Crust",21,2019/4/1
173291,sr_legacy_food,"PIZZA HUT 14"" Cheese Pizza, Pan Crust",21,2019/4/1
173292,sr_legacy_food,"Fast Food, Pizza Chain, 14"" pizza, cheese topping, regular crust",21,2019/4/1
173293,sr_legacy_food,"Fast Food, Pizza Chain, 14"" pizza, cheese topping, thick crust",21,2019/4/1
173294,sr_legacy_food,"Fast Food, Pizza Chain, 14"" pizza, cheese topping, thin crust",21,2019/4/1
173295,sr_legacy_food,"Fast Food, Pizza Chain, 14"" pizza, pepperoni topping, regular crust",21,2019/4/1
173296,sr_legacy_food,"Fast Food, Pizza Chain, 14"" pizza, pepperoni topping, thick crust",21,2019/4/1
173297,sr_legacy_food,"McDONALD'S, Chicken McNUGGETS",21,2019/4/1
173298,sr_legacy_food,"McDONALD'S, Hash Brown",21,2019/4/1
173299,sr_legacy_food,"McDONALD'S, Hotcakes (plain)",21,2019/4/1
173300,sr_legacy_food,"McDONALD'S, Bacon, Egg & Cheese McGRIDDLES",21,2019/4/1
173301,sr_legacy_food,"McDONALD'S, Hot Caramel Sundae",21,2019/4/1
173302,sr_legacy_food,"McDONALD'S, Hot Fudge Sundae",21,2019/4/1
173303,sr_legacy_food,"McDONALD'S, McFLURRY with M&M'S CANDIES",21,2019/4/1
173304,sr_legacy_food,"McDONALD'S, McFLURRY with OREO cookies",21,2019/4/1
173305,sr_legacy_food,"McDONALD'S, McCHICKEN Sandwich",21,2019/4/1
173306,sr_legacy_food,"McDONALD'S, McCHICKEN Sandwich (without mayonnaise)",21,2019/4/1
173307,sr_legacy_food,"McDONALD'S, Egg McMUFFIN",21,2019/4/1
173308,sr_legacy_food,"McDONALD'S, Sausage McMUFFIN",21,2019/4/1
173309,sr_legacy_food,"McDONALD'S, Deluxe Breakfast, with syrup and margarine",21,2019/4/1
173310,sr_legacy_food,"McDONALD'S, Hotcakes and Sausage",21,2019/4/1
173311,sr_legacy_food,"McDONALD'S, Hotcakes (with 2 pats margarine & syrup)",21,2019/4/1
173312,sr_legacy_food,"McDONALD'S, Bacon Ranch Salad with Grilled Chicken",21,2019/4/1
173313,sr_legacy_food,"McDONALD'S, Fruit 'n Yogurt Parfait (without granola)",21,2019/4/1
173314,sr_legacy_food,"McDONALD'S, FILET-O-FISH (without tartar sauce)",21,2019/4/1
173315,sr_legacy_food,"BURGER KING, CROISSAN'WICH with Sausage, Egg and Cheese",21,2019/4/1
173316,sr_legacy_food,"BURGER KING, CROISSAN'WICH with Sausage and Cheese",21,2019/4/1
173317,sr_legacy_food,"Fast foods, hamburger; single, large patty; with condiments, vegetables and mayonnaise",21,2019/4/1
173318,sr_legacy_food,"Fast foods, hamburger; single, regular patty; double decker bun with condiments and special sauce",21,2019/4/1
173319,sr_legacy_food,"Fast foods, cheeseburger; double, regular patty; with condiments",21,2019/4/1
173320,sr_legacy_food,"Fast foods, cheeseburger; double, large patty; with condiments",21,2019/4/1
173321,sr_legacy_food,"Fast foods, chicken tenders",21,2019/4/1
173322,sr_legacy_food,"Fast foods, bagel, with egg, sausage patty, cheese, and condiments",21,2019/4/1
173323,sr_legacy_food,"Fast foods, bagel, with breakfast steak, egg, cheese, and condiments",21,2019/4/1
173324,sr_legacy_food,"Light Ice Cream, soft serve, blended with milk chocolate candies",21,2019/4/1
173325,sr_legacy_food,"Macaroni and Cheese, canned entree",22,2019/4/1
173326,sr_legacy_food,"HOT POCKETS, CROISSANT POCKETS Chicken, Broccoli, and Cheddar Stuffed Sandwich, frozen",22,2019/4/1
173327,sr_legacy_food,"HOT POCKETS Ham 'N Cheese Stuffed Sandwich, frozen",22,2019/4/1
173328,sr_legacy_food,"Ravioli, cheese-filled, canned",22,2019/4/1
173329,sr_legacy_food,"Ravioli, meat-filled, with tomato sauce or meat sauce, canned",22,2019/4/1
173330,sr_legacy_food,"Beef stew, canned entree",22,2019/4/1
173331,sr_legacy_food,"Chicken pot pie, frozen entree, prepared",22,2019/4/1
173332,sr_legacy_food,"Beef, corned beef hash, with potato, canned",22,2019/4/1
173333,sr_legacy_food,"Lasagna, cheese, frozen, prepared",22,2019/4/1
173334,sr_legacy_food,"Lasagna with meat & sauce, frozen entree",22,2019/4/1
173335,sr_legacy_food,"Burrito, beef and bean, frozen",22,2019/4/1
173336,sr_legacy_food,"Burrito, bean and cheese, frozen",22,2019/4/1
173337,sr_legacy_food,"Macaroni and Cheese, canned, microwavable",22,2019/4/1
173338,sr_legacy_food,"Turkey, stuffing, mashed potatoes w/gravy, assorted vegetables, frozen, microwaved",22,2019/4/1
173339,sr_legacy_food,"Rice bowl with chicken, frozen entree, prepared (includes fried, teriyaki, and sweet and sour varieties)",22,2019/4/1
173340,sr_legacy_food,"Macaroni and cheese dinner with dry sauce mix, boxed, uncooked",22,2019/4/1
173341,sr_legacy_food,"Macaroni and cheese, dry mix, prepared with 2% milk and 80% stick margarine from dry mix",22,2019/4/1
173342,sr_legacy_food,"Macaroni and cheese, frozen entree",22,2019/4/1
173343,sr_legacy_food,Potato salad with egg,22,2019/4/1
173344,sr_legacy_food,Pulled pork in barbecue sauce,22,2019/4/1
173345,sr_legacy_food,"Corn dogs, frozen, prepared",22,2019/4/1
173346,sr_legacy_food,"Chicken tenders, breaded, frozen, prepared",22,2019/4/1
173347,sr_legacy_food,"RICE-A-RONI, chicken flavor, unprepared",22,2019/4/1
173348,sr_legacy_food,"Rice and vermicelli mix, chicken flavor, prepared with 80% margarine",22,2019/4/1
173349,sr_legacy_food,"Beef, shoulder pot roast or steak, boneless, separable lean and fat, trimmed to 0"" fat, all grades, raw",13,2019/4/1
173350,sr_legacy_food,"Beef, short loin, porterhouse steak, separable lean and fat, trimmed to 1/8"" fat, all grades, raw",13,2019/4/1
173351,sr_legacy_food,"Beef, short loin, t-bone steak, separable lean and fat, trimmed to 1/8"" fat, all grades, cooked, grilled",13,2019/4/1
173352,sr_legacy_food,"Beef, short loin, t-bone steak, separable lean and fat, trimmed to 1/8"" fat, select, raw",13,2019/4/1
173353,sr_legacy_food,"Beef, short loin, t-bone steak, separable lean and fat, trimmed to 1/8"" fat, select, cooked, grilled",13,2019/4/1
173354,sr_legacy_food,"Beef, round, knuckle, tip side, steak, separable lean and fat, trimmed to 0"" fat, choice, raw",13,2019/4/1
173355,sr_legacy_food,"Beef, chuck, shoulder clod, shoulder tender, medallion, separable lean and fat, trimmed to 0"" fat, choice, cooked, grilled",13,2019/4/1
173356,sr_legacy_food,"Beef, chuck, shoulder clod, shoulder tender, medallion, separable lean and fat, trimmed to 0"" fat, select, raw",13,2019/4/1
173357,sr_legacy_food,"Beef, chuck, shoulder clod, shoulder top and center steaks, separable lean and fat, trimmed to 0"" fat, choice, raw",13,2019/4/1
173358,sr_legacy_food,"Beef, chuck, shoulder clod, shoulder top and center steaks, separable lean and fat, trimmed to 0"" fat, choice, cooked, grilled",13,2019/4/1
173359,sr_legacy_food,"Beef, chuck, shoulder clod, top blade, steak, separable lean and fat, trimmed to 0"" fat, select, raw",13,2019/4/1
173360,sr_legacy_food,"Beef, chuck, shoulder clod, top blade, steak, separable lean and fat, trimmed to 0"" fat, select, cooked, grilled",13,2019/4/1
173361,sr_legacy_food,"Beef, round, knuckle, tip center, steak, separable lean and fat, trimmed to 0"" fat, choice, raw",13,2019/4/1
173362,sr_legacy_food,"Beef, round, knuckle, tip center, steak, separable lean and fat, trimmed to 0"" fat, choice, cooked, grilled",13,2019/4/1
173363,sr_legacy_food,"Beef, round, knuckle, tip center, steak, separable lean and fat, trimmed to 0"" fat, select, raw",13,2019/4/1
173364,sr_legacy_food,"Beef, round, outside round, bottom round, steak, separable lean and fat, trimmed to 0"" fat, select, cooked, grilled",13,2019/4/1
173365,sr_legacy_food,"Beef, chuck, shoulder clod, shoulder tender, medallion, separable lean and fat, trimmed to 0"" fat, all grades, raw",13,2019/4/1
173366,sr_legacy_food,"Beef, chuck, shoulder clod, shoulder tender, medallion, separable lean and fat, trimmed to 0"" fat, all grades, cooked, grilled",13,2019/4/1
173367,sr_legacy_food,"Beef, round, knuckle, tip side, steak, separable lean and fat, trimmed to 0"" fat, all grades, raw",13,2019/4/1
173368,sr_legacy_food,"Beef, chuck, shoulder clod, top blade, steak, separable lean and fat, trimmed to 0"" fat, all grades, cooked, grilled",13,2019/4/1
173369,sr_legacy_food,"Beef, round, knuckle, tip center, steak, separable lean and fat, trimmed to 0"" fat, all grades, raw",13,2019/4/1
173370,sr_legacy_food,"Beef, round, knuckle, tip center, steak, separable lean and fat, trimmed to 0"" fat, all grades, cooked, grilled",13,2019/4/1
173371,sr_legacy_food,"Beef, round, outside round, bottom round, steak, separable lean and fat, trimmed to 0"" fat, all grades, raw",13,2019/4/1
173372,sr_legacy_food,"Beef, rib eye roast, boneless, lip-on, separable lean only, trimmed to 1/8"" fat, select, cooked, roasted",13,2019/4/1
173373,sr_legacy_food,"Beef, plate steak, boneless, inside skirt, separable lean only, trimmed to 0"" fat, all grades, cooked, grilled",13,2019/4/1
173374,sr_legacy_food,"Beef, plate steak, boneless, inside skirt, separable lean only, trimmed to 0"" fat, all grades, raw",13,2019/4/1
173375,sr_legacy_food,"Beef, plate steak, boneless, inside skirt, separable lean only, trimmed to 0"" fat, choice, cooked, grilled",13,2019/4/1
173376,sr_legacy_food,"Beef, plate steak, boneless, outside skirt, separable lean only, trimmed to 0"" fat, all grades, raw",13,2019/4/1
173377,sr_legacy_food,"Beef, plate steak, boneless, outside skirt, separable lean only, trimmed to 0"" fat, choice, cooked, grilled",13,2019/4/1
173378,sr_legacy_food,"Beef, plate steak, boneless, outside skirt, separable lean only, trimmed to 0"" fat, choice, raw",13,2019/4/1
173379,sr_legacy_food,"Beef, plate steak, boneless, outside skirt, separable lean only, trimmed to 0"" fat, select, cooked, grilled",13,2019/4/1
173380,sr_legacy_food,"Beef, rib eye steak, boneless, lip off, separable lean only, trimmed to 0"" fat, choice, raw",13,2019/4/1
173381,sr_legacy_food,"Beef, rib eye steak, boneless, lip off, separable lean only, trimmed to 0"" fat, select, cooked, grilled",13,2019/4/1
173382,sr_legacy_food,"Beef, rib eye steak, boneless, lip off, separable lean only, trimmed to 0"" fat, select, raw",13,2019/4/1
173383,sr_legacy_food,"Beef, rib, back ribs, bone-in, separable lean only, trimmed to 0"" fat, all grades, cooked, braised",13,2019/4/1
173384,sr_legacy_food,"Beef, rib, back ribs, bone-in, separable lean only, trimmed to 0"" fat, select, raw",13,2019/4/1
173385,sr_legacy_food,"Beef, rib eye steak, bone-in, lip-on, separable lean and fat, trimmed to 1/8"" fat, choice, cooked, grilled",13,2019/4/1
173386,sr_legacy_food,"Beef, rib eye steak, bone-in, lip-on, separable lean and fat, trimmed to 1/8"" fat, select, cooked, grilled",13,2019/4/1
173387,sr_legacy_food,"Beef, rib eye steak, bone-in, lip-on, separable lean and fat, trimmed to 1/8"" fat, all grades, cooked, grilled",13,2019/4/1
173388,sr_legacy_food,"Beef, rib eye roast, bone-in, lip-on, separable lean and fat, trimmed to 1/8"" fat, choice, cooked, roasted",13,2019/4/1
173389,sr_legacy_food,"Beef, rib eye steak/roast, bone-in, lip-on, separable lean and fat, trimmed to 1/8"" fat, select, raw",13,2019/4/1
173390,sr_legacy_food,"Beef, rib eye steak, boneless, lip-on, separable lean and fat, trimmed to 1/8"" fat, choice, cooked, grilled",13,2019/4/1
173391,sr_legacy_food,"Beef, rib eye steak, boneless, lip-on, separable lean and fat, trimmed to 1/8"" fat, select, cooked, grilled",13,2019/4/1
173392,sr_legacy_food,"Beef, rib eye steak, boneless, lip-on, separable lean and fat, trimmed to 1/8"" fat, all grades, cooked, grilled",13,2019/4/1
173393,sr_legacy_food,"Beef, rib eye steak/roast, boneless, lip-on, separable lean and fat, trimmed to 1/8"" fat, choice, raw",13,2019/4/1
173394,sr_legacy_food,"Beef, rib eye steak/roast, boneless, lip-on, separable lean and fat, trimmed to 1/8"" fat, select, raw",13,2019/4/1
173395,sr_legacy_food,"Beef, plate steak, boneless, inside skirt, separable lean and fat, trimmed to 0"" fat, all grades, cooked, grilled",13,2019/4/1
173396,sr_legacy_food,"Beef, plate steak, boneless, inside skirt, separable lean and fat, trimmed to 0"" fat, choice, cooked, grilled",13,2019/4/1
173397,sr_legacy_food,"Beef, plate steak, boneless, outside skirt, separable lean and fat, trimmed to 0"" fat, all grades, cooked, grilled",13,2019/4/1
173398,sr_legacy_food,"Beef, plate steak, boneless, outside skirt, separable lean and fat, trimmed to 0"" fat, choice, cooked, grilled",13,2019/4/1
173399,sr_legacy_food,"Beef, plate steak, boneless, outside skirt, separable lean and fat, trimmed to 0"" fat, select, cooked, grilled",13,2019/4/1
173400,sr_legacy_food,"Beef, plate steak, boneless, outside skirt, separable lean and fat, trimmed to 0"" fat, all grades, raw",13,2019/4/1
173401,sr_legacy_food,"Beef, rib eye steak, boneless, lip off, separable lean and fat, trimmed to 0"" fat, select, cooked, grilled",13,2019/4/1
173402,sr_legacy_food,"Beef, rib eye steak, boneless, lip off, separable lean and fat, trimmed to 0"" fat, all grades, raw",13,2019/4/1
173403,sr_legacy_food,"Beef, rib eye steak, boneless, lip off, separable lean and fat, trimmed to 0"" fat, choice, raw",13,2019/4/1
173404,sr_legacy_food,"Beef, rib eye steak, boneless, lip off, separable lean and fat, trimmed to 0"" fat, select, raw",13,2019/4/1
173405,sr_legacy_food,"Beef, rib, back ribs, bone-in, separable lean and fat, trimmed to 0"" fat, choice, raw",13,2019/4/1
173406,sr_legacy_food,"Beef, rib, back ribs, bone-in, separable lean and fat, trimmed to 0"" fat, select, raw",13,2019/4/1
173407,sr_legacy_food,"Beef, loin, top sirloin petite roast, boneless, separable lean only, trimmed to 0"" fat, choice, cooked, roasted",13,2019/4/1
173408,sr_legacy_food,"Beef, loin, top sirloin petite roast/filet, boneless, separable lean only, trimmed to 0"" fat, choice, raw",13,2019/4/1
173409,sr_legacy_food,"Beef, loin, top sirloin cap steak, boneless, separable lean only, trimmed to 1/8"" fat, select, raw",13,2019/4/1
173410,sr_legacy_food,"Butter, salted",1,2019/4/1
173411,sr_legacy_food,"Butter, whipped, with salt",1,2019/4/1
173412,sr_legacy_food,"Butter oil, anhydrous",1,2019/4/1
173413,sr_legacy_food,"Cheese, caraway",1,2019/4/1
173414,sr_legacy_food,"Cheese, cheddar (Includes foods for USDA's Food Distribution Program)",1,2019/4/1
173415,sr_legacy_food,"Cheese, cheshire",1,2019/4/1
173416,sr_legacy_food,"Cheese, colby",1,2019/4/1
173417,sr_legacy_food,"Cheese, cottage, lowfat, 1% milkfat",1,2019/4/1
173418,sr_legacy_food,"Cheese, cream",1,2019/4/1
173419,sr_legacy_food,"Cheese, edam",1,2019/4/1
173420,sr_legacy_food,"Cheese, feta",1,2019/4/1
173421,sr_legacy_food,"Egg, yolk, raw, frozen, pasteurized",1,2019/4/1
173422,sr_legacy_food,"Egg, yolk, raw, frozen, sugared, pasteurized",1,2019/4/1
173423,sr_legacy_food,"Egg, whole, cooked, fried",1,2019/4/1
173424,sr_legacy_food,"Egg, whole, cooked, hard-boiled",1,2019/4/1
173425,sr_legacy_food,"Egg, whole, dried, stabilized, glucose reduced",1,2019/4/1
173426,sr_legacy_food,"Egg, white, dried, flakes, stabilized, glucose reduced",1,2019/4/1
173427,sr_legacy_food,"Egg, white, dried, powder, stabilized, glucose reduced",1,2019/4/1
173428,sr_legacy_food,"Egg, yolk, dried",1,2019/4/1
173429,sr_legacy_food,"Egg substitute, powder",1,2019/4/1
173430,sr_legacy_food,"Butter, without salt",1,2019/4/1
173431,sr_legacy_food,"Cheese, parmesan, shredded",1,2019/4/1
173432,sr_legacy_food,"Milk, nonfat, fluid, without added vitamin A and vitamin D (fat free or skim)",1,2019/4/1
173433,sr_legacy_food,"Cheese, goat, semisoft type",1,2019/4/1
173434,sr_legacy_food,"Yogurt, Greek, 2% fat, key lime blend, CHOBANI",1,2019/4/1
173435,sr_legacy_food,"Cheese, goat, soft type",1,2019/4/1
173436,sr_legacy_food,"Egg, yolk, raw, frozen, salted, pasteurized",1,2019/4/1
173437,sr_legacy_food,"Cheese, mexican, queso asadero",1,2019/4/1
173438,sr_legacy_food,"Cheese, mexican, queso chihuahua",1,2019/4/1
173439,sr_legacy_food,"Cheese, low fat, cheddar or colby",1,2019/4/1
173440,sr_legacy_food,"Cheese, low-sodium, cheddar or colby",1,2019/4/1
173441,sr_legacy_food,"Milk, fluid, 1% fat, without added vitamin A and vitamin D",1,2019/4/1
173442,sr_legacy_food,"Sour cream, reduced fat",1,2019/4/1
173443,sr_legacy_food,"Sour cream, light",1,2019/4/1
173444,sr_legacy_food,"Sour cream, fat free",1,2019/4/1
173445,sr_legacy_food,"Yogurt, vanilla or lemon flavor, nonfat milk, sweetened with low-calorie sweetener",1,2019/4/1
173446,sr_legacy_food,KRAFT CHEEZ WHIZ LIGHT Pasteurized Process Cheese Product,1,2019/4/1
173447,sr_legacy_food,KRAFT FREE Singles American Nonfat Pasteurized Process Cheese Product,1,2019/4/1
173448,sr_legacy_food,KRAFT VELVEETA Pasteurized Process Cheese Spread,1,2019/4/1
173449,sr_legacy_food,KRAFT VELVEETA LIGHT Reduced Fat Pasteurized Process Cheese Product,1,2019/4/1
173450,sr_legacy_food,"Milk, chocolate, fluid, commercial, reduced fat, with added calcium",1,2019/4/1
173451,sr_legacy_food,"Yogurt, fruit, lowfat, with low calorie sweetener",1,2019/4/1
173452,sr_legacy_food,"Cheese, parmesan, dry grated, reduced fat",1,2019/4/1
173453,sr_legacy_food,"Cream substitute, flavored, liquid",1,2019/4/1
173454,sr_legacy_food,"Milk, dry, whole, without added vitamin D",1,2019/4/1
173455,sr_legacy_food,"Cheese product, pasteurized process, American, reduced fat, fortified with vitamin D",1,2019/4/1
173456,sr_legacy_food,"Yogurt, fruit, low fat, 9 grams protein per 8 ounce, fortified with vitamin D",1,2019/4/1
173457,sr_legacy_food,"Yogurt, fruit, low fat, 10 grams protein per 8 ounce, fortified with vitamin D",1,2019/4/1
173458,sr_legacy_food,"Yogurt, fruit variety, nonfat, fortified with vitamin D",1,2019/4/1
