fdc_id,data_type,description,food_category_id,publication_date
171544,sr_legacy_food,"Soup, chicken rice, canned, chunky, ready-to-serve",6,2019/4/1
171545,sr_legacy_food,"Soup, chicken with rice, canned, condensed",6,2019/4/1
171546,sr_legacy_food,"Soup, chicken and vegetable, canned, ready-to-serve",6,2019/4/1
171547,sr_legacy_food,"Soup, clam chowder, new england, canned, condensed",6,2019/4/1
171548,sr_legacy_food,"Soup, beef broth bouillon and consomme, canned, condensed",6,2019/4/1
171549,sr_legacy_food,"Soup, lentil with ham, canned, ready-to-serve",6,2019/4/1
171550,sr_legacy_food,"Soup, minestrone, canned, chunky, ready-to-serve",6,2019/4/1
171551,sr_legacy_food,"Soup, onion, canned, condensed",6,2019/4/1
171552,sr_legacy_food,"Soup, cream of onion, canned, condensed",6,2019/4/1
171553,sr_legacy_food,"Soup, oyster stew, canned, condensed",6,2019/4/1
171554,sr_legacy_food,"Soup, pea, green, canned, condensed",6,2019/4/1
171555,sr_legacy_food,"Soup, pea, split with ham, canned, chunky, ready-to-serve",6,2019/4/1
171556,sr_legacy_food,"CAMPBELL'S, Chicken Noodle Soup, condensed",6,2019/4/1
171557,sr_legacy_food,"Soup, tomato rice, canned, condensed",6,2019/4/1
171558,sr_legacy_food,"Soup, turkey, chunky, canned, ready-to-serve",6,2019/4/1
171559,sr_legacy_food,"Soup, chunky vegetable, canned, ready-to-serve",6,2019/4/1
171560,sr_legacy_food,"Soup, beef broth or bouillon, powder, dry",6,2019/4/1
171561,sr_legacy_food,"Soup, beef broth, cubed, dry",6,2019/4/1
171562,sr_legacy_food,"Soup, chicken broth or bouillon, dry",6,2019/4/1
171563,sr_legacy_food,"Soup, chicken broth cubes, dry",6,2019/4/1
171564,sr_legacy_food,"Gravy, beef, canned, ready-to-serve",6,2019/4/1
171565,sr_legacy_food,"Gravy, brown, dry",6,2019/4/1
171566,sr_legacy_food,"Gravy, chicken, canned or bottled, ready-to-serve",6,2019/4/1
171567,sr_legacy_food,"Gravy, chicken, dry",6,2019/4/1
171568,sr_legacy_food,"Gravy, turkey, canned, ready-to-serve",6,2019/4/1
171569,sr_legacy_food,"Gravy, turkey, dry",6,2019/4/1
171570,sr_legacy_food,"Gravy, unspecified type, dry",6,2019/4/1
171571,sr_legacy_food,"Soup, chicken noodle, dry, mix",6,2019/4/1
171572,sr_legacy_food,"Soup, beef mushroom, canned, prepared with equal volume water",6,2019/4/1
171573,sr_legacy_food,"Soup, chicken mushroom, canned, prepared with equal volume water",6,2019/4/1
171574,sr_legacy_food,"Soup, tomato bisque, canned, prepared with equal volume water",6,2019/4/1
171575,sr_legacy_food,"Sauce, peanut, made from coconut, water, sugar, peanuts",6,2019/4/1
171576,sr_legacy_food,"SMART SOUP, Santa Fe Corn Chowder",6,2019/4/1
171577,sr_legacy_food,"SMART SOUP, French Lentil",6,2019/4/1
171578,sr_legacy_food,"SMART SOUP, Greek Minestrone",6,2019/4/1
171579,sr_legacy_food,"Sauce, pesto, ready-to-serve, refrigerated",6,2019/4/1
171580,sr_legacy_food,"Sauce, pesto, ready-to-serve, shelf stable",6,2019/4/1
171581,sr_legacy_food,"Sauce, pesto, BUITONI, pesto with basil, ready-to-serve, refrigerated",6,2019/4/1
171582,sr_legacy_food,"Sauce, pesto, CLASSICO, basil pesto, ready-to-serve",6,2019/4/1
171583,sr_legacy_food,"Soup, vegetable broth, ready to serve",6,2019/4/1
171584,sr_legacy_food,"Sauce, cheese sauce mix, dry",6,2019/4/1
171585,sr_legacy_food,"Soup, chicken corn chowder, chunky, ready-to-serve, single brand",6,2019/4/1
171586,sr_legacy_food,"Soup, bean with bacon, condensed, single brand",6,2019/4/1
171587,sr_legacy_food,"Soup, tomato, canned, condensed, reduced sodium",6,2019/4/1
171588,sr_legacy_food,"Gravy, brown instant, dry",6,2019/4/1
171589,sr_legacy_food,"Gravy, instant beef, dry",6,2019/4/1
171590,sr_legacy_food,"Gravy, instant turkey, dry",6,2019/4/1
171591,sr_legacy_food,"Soup, tomato, low sodium, with water",6,2019/4/1
171592,sr_legacy_food,"Soup, pea, low sodium, prepared with equal volume water",6,2019/4/1
171593,sr_legacy_food,"Soup, chicken noodle, low sodium, canned, prepared with equal volume water",6,2019/4/1
171594,sr_legacy_food,"Soup, vegetable soup, condensed, low sodium, prepared with equal volume water",6,2019/4/1
171595,sr_legacy_food,"Sauce, tomato chili sauce, bottled, with salt",6,2019/4/1
171596,sr_legacy_food,"Soup, vegetable chicken, canned, prepared with water, low sodium",6,2019/4/1
171597,sr_legacy_food,"Sauce, pasta, spaghetti/marinara, ready-to-serve, low sodium",6,2019/4/1
171598,sr_legacy_food,"Gravy, meat or poultry, low sodium, prepared",6,2019/4/1
171599,sr_legacy_food,"Gravy, HEINZ Home Style, savory beef",6,2019/4/1
171600,sr_legacy_food,"Gravy, CAMPBELL'S, chicken",6,2019/4/1
171601,sr_legacy_food,"Barbecue loaf, pork, beef",7,2019/4/1
171602,sr_legacy_food,"Soup, cream of chicken, canned, condensed, reduced sodium",6,2019/4/1
171603,sr_legacy_food,"Sauce, alfredo mix, dry",6,2019/4/1
171604,sr_legacy_food,"Sauce, peppers, hot, chili, mature red, canned",6,2019/4/1
171605,sr_legacy_food,"Sauce, chili, peppers, hot, immature green, canned",6,2019/4/1
171606,sr_legacy_food,Fish broth,6,2019/4/1
171607,sr_legacy_food,"Soup, cream of mushroom, low sodium, ready-to-serve, canned",6,2019/4/1
171608,sr_legacy_food,"Potato soup, instant, dry mix",6,2019/4/1
171609,sr_legacy_food,"Soup, chicken broth, low sodium, canned",6,2019/4/1
171610,sr_legacy_food,"Sauce, worcestershire",6,2019/4/1
171611,sr_legacy_food,"Soup, beef and mushroom, low sodium, chunk style",6,2019/4/1
171612,sr_legacy_food,"Soup, beef stroganoff, canned, chunky style, ready-to-serve",6,2019/4/1
171613,sr_legacy_food,"Soup, bouillon cubes and granules, low sodium, dry",6,2019/4/1
171614,sr_legacy_food,"Soup, ramen noodle, beef flavor, dry",6,2019/4/1
171615,sr_legacy_food,"Soup, ramen noodle, chicken flavor, dry",6,2019/4/1
171616,sr_legacy_food,"Beerwurst, beer salami, pork",7,2019/4/1
171617,sr_legacy_food,"Sausage, Berliner, pork, beef",7,2019/4/1
171618,sr_legacy_food,Blood sausage,7,2019/4/1
171619,sr_legacy_food,"Bockwurst, pork, veal, raw",7,2019/4/1
171620,sr_legacy_food,"Bratwurst, pork, cooked",7,2019/4/1
171621,sr_legacy_food,"Braunschweiger (a liver sausage), pork",7,2019/4/1
171622,sr_legacy_food,"Bratwurst, pork, beef, link",7,2019/4/1
171623,sr_legacy_food,"Cheesefurter, cheese smokie, pork, beef",7,2019/4/1
171624,sr_legacy_food,"Frankfurter, chicken",7,2019/4/1
171625,sr_legacy_food,"Frankfurter, turkey",7,2019/4/1
171626,sr_legacy_food,"Ham, chopped, canned",7,2019/4/1
171627,sr_legacy_food,"Ham, chopped, not canned",7,2019/4/1
171628,sr_legacy_food,Ham and cheese loaf or roll,7,2019/4/1
171629,sr_legacy_food,Ham and cheese spread,7,2019/4/1
171630,sr_legacy_food,"Headcheese, pork",7,2019/4/1
171631,sr_legacy_food,"Sausage, Italian, pork, mild, raw",7,2019/4/1
171632,sr_legacy_food,"Sausage, pork and turkey, pre-cooked",7,2019/4/1
171633,sr_legacy_food,"Frankfurter, meat and poultry, cooked, boiled",7,2019/4/1
171634,sr_legacy_food,"Frankfurter, meat and poultry, cooked, grilled",7,2019/4/1
171635,sr_legacy_food,"Pork sausage, link/patty, reduced fat, unprepared",7,2019/4/1
171636,sr_legacy_food,"Pork sausage, link/patty, reduced fat, cooked, pan-fried",7,2019/4/1
171637,sr_legacy_food,"Bologna, meat and poultry",7,2019/4/1
171638,sr_legacy_food,"Meatballs, frozen, Italian style",7,2019/4/1
171639,sr_legacy_food,"Bacon, turkey, microwaved",7,2019/4/1
171640,sr_legacy_food,"Bacon, turkey, low sodium",7,2019/4/1
171641,sr_legacy_food,"Cereals ready-to-eat, POST, ALPHA-BITS",8,2019/4/1
171642,sr_legacy_food,"Cereals ready-to-eat, QUAKER, CAP'N CRUNCH",8,2019/4/1
171643,sr_legacy_food,"Cereals ready-to-eat, QUAKER, CAP'N CRUNCH with CRUNCHBERRIES",8,2019/4/1
171644,sr_legacy_food,"Cereals ready-to-eat, QUAKER, CAP'N CRUNCH'S PEANUT BUTTER CRUNCH",8,2019/4/1
171645,sr_legacy_food,"Cereals ready-to-eat, POST, FRUITY PEBBLES",8,2019/4/1
171646,sr_legacy_food,"Cereals ready-to-eat, granola, homemade",8,2019/4/1
171647,sr_legacy_food,"Cereals ready-to-eat, POST, GRAPE-NUTS Cereal",8,2019/4/1
171648,sr_legacy_food,"Cereals ready-to-eat, POST, GRAPE-NUTS Flakes",8,2019/4/1
171649,sr_legacy_food,"Cereals ready-to-eat, QUAKER, SWEET CRUNCH/QUISP",8,2019/4/1
171650,sr_legacy_food,"Cereals ready-to-eat, POST Raisin Bran Cereal",8,2019/4/1
171651,sr_legacy_food,"Cereals ready-to-eat, QUAKER, QUAKER Puffed Rice",8,2019/4/1
171652,sr_legacy_food,"Cereals ready-to-eat, POST, GOLDEN CRISP",8,2019/4/1
171653,sr_legacy_food,"Cereals ready-to-eat, SUN COUNTRY, KRETSCHMER Honey Crunch Wheat Germ",8,2019/4/1
171654,sr_legacy_food,"Cereals, corn grits, white, regular and quick, enriched, dry",8,2019/4/1
171655,sr_legacy_food,"Cereals, corn grits, white, regular and quick, enriched, cooked with water, without salt",8,2019/4/1
171656,sr_legacy_food,"Cereals, QUAKER, corn grits, instant, plain, dry",8,2019/4/1
171657,sr_legacy_food,"Cereals, CREAM OF WHEAT, regular (10 minute), cooked with water, without salt",8,2019/4/1
171658,sr_legacy_food,"Cereals, farina, enriched, assorted brands including CREAM OF WHEAT, quick (1-3 minutes), dry",8,2019/4/1
171659,sr_legacy_food,"Cereals, farina, enriched, assorted brands including CREAM OF WHEAT, quick (1-3 minutes), cooked with water, without salt",8,2019/4/1
171660,sr_legacy_food,"Cereals, CREAM OF WHEAT, instant, dry",8,2019/4/1
171661,sr_legacy_food,"Cereals, oats, instant, fortified, plain, dry",8,2019/4/1
171662,sr_legacy_food,"Cereals, oats, instant, fortified, plain, prepared with water (boiling water added or microwaved)",8,2019/4/1
171663,sr_legacy_food,"Cereals, QUAKER, Instant Oatmeal, apples and cinnamon, dry",8,2019/4/1
171664,sr_legacy_food,"Cereals, oats, instant, fortified, with cinnamon and spice, dry",8,2019/4/1
171665,sr_legacy_food,"Cereals, WHEATENA, dry",8,2019/4/1
171666,sr_legacy_food,"Cereals, WHEATENA, cooked with water",8,2019/4/1
171667,sr_legacy_food,"Cereals, whole wheat hot natural cereal, dry",8,2019/4/1
171668,sr_legacy_food,"Cereals, whole wheat hot natural cereal, cooked with water, without salt",8,2019/4/1
171669,sr_legacy_food,"Cereals ready-to-eat, QUAKER, QUAKER Puffed Wheat",8,2019/4/1
171670,sr_legacy_food,"Cereals, corn grits, yellow, regular and quick, unenriched, dry",8,2019/4/1
171671,sr_legacy_food,"Cereals, corn grits, white, regular and quick, enriched, cooked with water, with salt",8,2019/4/1
171672,sr_legacy_food,"Cereals, corn grits, yellow, regular and quick, enriched, cooked with water, without salt",8,2019/4/1
171673,sr_legacy_food,"Cereals, corn grits, yellow, regular, quick, enriched, cooked with water, with salt",8,2019/4/1
171674,sr_legacy_food,"Cereals, MALT-O-MEAL, chocolate, dry",8,2019/4/1
171675,sr_legacy_food,"Cereals, oats, regular and quick and instant, unenriched, cooked with water (includes boiling and microwaving), with salt",8,2019/4/1
171676,sr_legacy_food,"Cereals, WHEATENA, cooked with water, with salt",8,2019/4/1
171677,sr_legacy_food,"Cereals, whole wheat hot natural cereal, cooked with water, with salt",8,2019/4/1
171678,sr_legacy_food,"Cereals, ready-to-eat, MALT-O-MEAL, Blueberry Mini SPOONERS",8,2019/4/1
171679,sr_legacy_food,"Cereals ready-to-eat, MALT-O-MEAL, OAT BLENDERS with honey",8,2019/4/1
171680,sr_legacy_food,"Cereals ready-to-eat, MALT-O-MEAL, OAT BLENDERS with honey & almonds",8,2019/4/1
171681,sr_legacy_food,"Cereals ready-to-eat, MALT-O-MEAL, Honey Nut SCOOTERS",8,2019/4/1
171682,sr_legacy_food,"Cereals, QUAKER, Instant Oatmeal, Cinnamon Swirl, high fiber",8,2019/4/1
171683,sr_legacy_food,"Cereals, QUAKER, oatmeal, REAL MEDLEYS, blueberry hazelnut, dry",8,2019/4/1
171684,sr_legacy_food,"Cereals, QUAKER, oatmeal, REAL MEDLEYS, apple walnut, dry",8,2019/4/1
171685,sr_legacy_food,"Cereals, QUAKER, oatmeal, REAL MEDLEYS, summer berry, dry",8,2019/4/1
171686,sr_legacy_food,"Acerola, (west indian cherry), raw",9,2019/4/1
171687,sr_legacy_food,"Acerola juice, raw",9,2019/4/1
171688,sr_legacy_food,"Apples, raw, with skin (Includes foods for USDA's Food Distribution Program)",9,2019/4/1
171689,sr_legacy_food,"Apples, raw, without skin",9,2019/4/1
171690,sr_legacy_food,"Apples, dehydrated (low moisture), sulfured, stewed",9,2019/4/1
171691,sr_legacy_food,"Apples, dried, sulfured, uncooked",9,2019/4/1
171692,sr_legacy_food,"Apples, dried, sulfured, stewed, without added sugar",9,2019/4/1
171693,sr_legacy_food,"Apples, dried, sulfured, stewed, with added sugar",9,2019/4/1
171694,sr_legacy_food,"Apples, frozen, unsweetened, unheated (Includes foods for USDA's Food Distribution Program)",9,2019/4/1
171695,sr_legacy_food,"Applesauce, canned, unsweetened, without added ascorbic acid (Includes foods for USDA's Food Distribution Program)",9,2019/4/1
171696,sr_legacy_food,"Applesauce, canned, sweetened, without salt",9,2019/4/1
171697,sr_legacy_food,"Apricots, raw",9,2019/4/1
171698,sr_legacy_food,"Apricots, canned, water pack, with skin, solids and liquids",9,2019/4/1
171699,sr_legacy_food,"Apricots, canned, heavy syrup pack, with skin, solids and liquids",9,2019/4/1
171700,sr_legacy_food,"Apricots, canned, heavy syrup pack, without skin, solids and liquids",9,2019/4/1
171701,sr_legacy_food,"Apricots, canned, extra heavy syrup pack, without skin, solids and liquids",9,2019/4/1
171702,sr_legacy_food,"Apricots, dehydrated (low-moisture), sulfured, uncooked",9,2019/4/1
171703,sr_legacy_food,"Apricots, frozen, sweetened",9,2019/4/1
171704,sr_legacy_food,"Apricot nectar, canned, with added ascorbic acid",9,2019/4/1
171705,sr_legacy_food,"Avocados, raw, all commercial varieties",9,2019/4/1
171706,sr_legacy_food,"Avocados, raw, California",9,2019/4/1
171707,sr_legacy_food,"Avocados, raw, Florida",9,2019/4/1
171708,sr_legacy_food,"Cherries, tart, dried, sweetened (Includes foods for USDA's Food Distribution Program)",9,2019/4/1
171709,sr_legacy_food,"Blackberries, canned, heavy syrup, solids and liquids",9,2019/4/1
171710,sr_legacy_food,"Blackberries, frozen, unsweetened",9,2019/4/1
171711,sr_legacy_food,"Blueberries, raw",9,2019/4/1
171712,sr_legacy_food,"Boysenberries, canned, heavy syrup",9,2019/4/1
171713,sr_legacy_food,"Boysenberries, frozen, unsweetened",9,2019/4/1
171714,sr_legacy_food,"Breadfruit, raw",9,2019/4/1
171715,sr_legacy_food,"Carambola, (starfruit), raw",9,2019/4/1
171716,sr_legacy_food,"Cherries, sour, red, canned, heavy syrup pack, solids and liquids",9,2019/4/1
171717,sr_legacy_food,"Cherries, sour, red, canned, extra heavy syrup pack, solids and liquids",9,2019/4/1
171718,sr_legacy_food,"Cherries, sour, red, frozen, unsweetened (Includes foods for USDA's Food Distribution Program)",9,2019/4/1
171719,sr_legacy_food,"Cherries, sweet, raw",9,2019/4/1
171720,sr_legacy_food,"Cherries, sweet, canned, extra heavy syrup pack, solids and liquids",9,2019/4/1
171721,sr_legacy_food,"Crabapples, raw",9,2019/4/1
171722,sr_legacy_food,"Cranberries, raw",9,2019/4/1
171723,sr_legacy_food,"Cranberries, dried, sweetened (Includes foods for USDA's Food Distribution Program)",9,2019/4/1
171724,sr_legacy_food,"Currants, zante, dried",9,2019/4/1
171725,sr_legacy_food,"Custard-apple, (bullock's-heart), raw",9,2019/4/1
171726,sr_legacy_food,"Dates, deglet noor",9,2019/4/1
171727,sr_legacy_food,"Elderberries, raw",9,2019/4/1
171728,sr_legacy_food,"Beef, Australian, imported, grass-fed,  external fat, raw",13,2019/4/1
171729,sr_legacy_food,"Beef, Australian, imported, grass-fed, seam fat, raw",13,2019/4/1
171730,sr_legacy_food,"Beef, Australian, imported, Wagyu, external fat, Aust. marble score 4/5, raw",13,2019/4/1
171731,sr_legacy_food,"Beef, Australian, imported, Wagyu, seam fat, Aust. marble score 4/5, raw",13,2019/4/1
171732,sr_legacy_food,"Beef, Australian, imported, Wagyu, loin, tenderloin steak/roast, boneless, separable lean and fat, Aust. marble score 4/5, raw",13,2019/4/1
171733,sr_legacy_food,"Beef, Australian, imported, grass-fed, loin, top loin steak/roast, boneless, separable lean and fat, raw",13,2019/4/1
171734,sr_legacy_food,"Beef, Australian, imported, grass-fed, loin, top sirloin cap-off steak/roast, boneless, separable lean only, raw",13,2019/4/1
171735,sr_legacy_food,"Beef, Australian, imported, grass-fed, rib, ribeye steak/roast lip-on, boneless, separable lean only, raw",13,2019/4/1
171736,sr_legacy_food,"Beef, Australian, imported, Wagyu, loin, top loin steak/roast, boneless, separable lean only, Aust. marble score 9, raw",13,2019/4/1
171737,sr_legacy_food,"Beef, Australian, imported, Wagyu, rib, small end rib steak/roast, boneless, separable lean only, Aust. marble score 4/5, raw",13,2019/4/1
171738,sr_legacy_food,"Beef, Australian, imported, Wagyu, rib, small end rib steak/roast, boneless, separable lean only, Aust. marble score 9, raw",13,2019/4/1
171739,sr_legacy_food,"Beef, Australian, imported, grass-fed, loin, top sirloin cap-off steak/roast, boneless, separable lean and fat, raw",13,2019/4/1
171740,sr_legacy_food,"Beef, Australian, imported, Wagyu, rib, small end rib steak/roast, boneless, separable lean and fat, Aust. marble score 4/5, raw",13,2019/4/1
171741,sr_legacy_food,"Beef, Australian, imported, Wagyu, rib, small end rib steak/roast, boneless, separable lean and fat, Aust. marble score 9, raw",13,2019/4/1
171742,sr_legacy_food,"Beef, Australian, imported, Wagyu, loin, tenderloin steak/roast, boneless, separable lean and fat, Aust. marble score 9, raw",13,2019/4/1
171743,sr_legacy_food,"Beef, round, top round steak, boneless, separable lean and fat, trimmed to 0"" fat, all grades, raw",13,2019/4/1
171744,sr_legacy_food,"Beef, round, top round roast, boneless, separable lean and fat, trimmed to 0"" fat, select, raw",13,2019/4/1
171745,sr_legacy_food,"Beef, round, eye of round roast, boneless, separable lean and fat, trimmed to 0"" fat, all grades, raw",13,2019/4/1
171746,sr_legacy_food,"Beef, round, eye of round roast, boneless, separable lean and fat, trimmed to 0"" fat, choice, raw",13,2019/4/1
171747,sr_legacy_food,"Beef, round, eye of round roast, boneless, separable lean and fat, trimmed to 0"" fat, select, raw",13,2019/4/1
171748,sr_legacy_food,"Beef, loin, tenderloin roast, boneless, separable lean and fat, trimmed to 0"" fat, choice, raw",13,2019/4/1
171749,sr_legacy_food,"Beef, loin, tenderloin roast, boneless, separable lean and fat, trimmed to 0"" fat, select, raw",13,2019/4/1
171750,sr_legacy_food,"Beef, loin, top loin steak, boneless, lip off, separable lean and fat, trimmed to 0"" fat, all grades, raw",13,2019/4/1
171751,sr_legacy_food,"Beef, loin, top loin steak, boneless, lip off, separable lean and fat, trimmed to 0"" fat, choice, raw",13,2019/4/1
171752,sr_legacy_food,"Beef, loin, top loin steak, boneless, lip off, separable lean and fat, trimmed to 0"" fat, select, raw",13,2019/4/1
171753,sr_legacy_food,"Beef, loin, tenderloin roast, boneless, separable lean and fat, trimmed to 0"" fat, choice, cooked, roasted",13,2019/4/1
171754,sr_legacy_food,"Beef, loin, tenderloin roast, boneless, separable lean and fat, trimmed to 0"" fat, select, cooked, roasted",13,2019/4/1
171755,sr_legacy_food,"Beef, round, top round roast, boneless, separable lean and fat, trimmed to 0"" fat, all grades, cooked, roasted",13,2019/4/1
171756,sr_legacy_food,"Beef, round, top round roast, boneless, separable lean and fat, trimmed to 0"" fat, choice, cooked, roasted",13,2019/4/1
171757,sr_legacy_food,"Beef, round, top round steak, boneless, separable lean only, trimmed to 0"" fat, all grades, raw",13,2019/4/1
171758,sr_legacy_food,"Beef, round, top round steak, boneless, separable lean only, trimmed to 0"" fat, choice, raw",13,2019/4/1
171759,sr_legacy_food,"Beef, round, top round steak, boneless, separable lean only, trimmed to 0"" fat, select, raw",13,2019/4/1
171760,sr_legacy_food,"Beef, round, top round roast, boneless, separable lean only, trimmed to 0"" fat, all grades, raw",13,2019/4/1
171761,sr_legacy_food,"Beef, round, eye of round roast, boneless, separable lean only, trimmed to 0"" fat, select, raw",13,2019/4/1
171762,sr_legacy_food,"Beef, round, eye of round steak, boneless, separable lean only, trimmed to 0"" fat, all grades, raw",13,2019/4/1
171763,sr_legacy_food,"Beef, round, eye of round steak, boneless, separable lean only, trimmed to 0"" fat, choice, raw",13,2019/4/1
171764,sr_legacy_food,"Beef, round, eye of round steak, boneless, separable lean only, trimmed to 0"" fat, select, raw",13,2019/4/1
171765,sr_legacy_food,"Beef, loin, tenderloin roast, boneless, separable lean only, trimmed to 0"" fat, all grades, raw",13,2019/4/1
171766,sr_legacy_food,"Beef, loin, top loin steak, boneless, lip off, separable lean only, trimmed to 0"" fat, select, raw",13,2019/4/1
171767,sr_legacy_food,"Beef, loin, tenderloin steak, boneless, separable lean only, trimmed to 0"" fat, all grades, raw",13,2019/4/1
171768,sr_legacy_food,"Beef, loin, tenderloin steak, boneless, separable lean only, trimmed to 0"" fat, choice, raw",13,2019/4/1
171769,sr_legacy_food,"Beef, loin, tenderloin steak, boneless, separable lean only, trimmed to 0"" fat, select, raw",13,2019/4/1
171770,sr_legacy_food,"Beef, round, top round roast, boneless, separable lean only, trimmed to 0"" fat, choice, cooked, roasted",13,2019/4/1
171771,sr_legacy_food,"Beef, round, top round roast, boneless, separable lean only, trimmed to 0"" fat, select, cooked, roasted",13,2019/4/1
171772,sr_legacy_food,"Beef, round, eye of round steak, boneless, separable lean only, trimmed to 0"" fat, all grades, cooked, grilled",13,2019/4/1
171773,sr_legacy_food,"Beef, round, eye of round steak, boneless, separable lean only, trimmed to 0"" fat, choice, cooked, grilled",13,2019/4/1
171774,sr_legacy_food,"Beef, loin, top loin steak, boneless, lip-on, separable lean and fat, trimmed to 1/8"" fat, select, raw",13,2019/4/1
171775,sr_legacy_food,"Beef, loin, top loin steak, boneless, lip-on, separable lean and fat, trimmed to 1/8"" fat, all grades, raw",13,2019/4/1
171776,sr_legacy_food,"Beef, composite of trimmed retail cuts, separable lean only, trimmed to 0"" fat, select, raw",13,2019/4/1
171777,sr_legacy_food,"Beef, composite of trimmed retail cuts, separable lean and fat, trimmed to 0"" fat, select, raw",13,2019/4/1
171778,sr_legacy_food,"Beef, composite of trimmed retail cuts, separable lean only, trimmed to 1/8"" fat, select, cooked",13,2019/4/1
171779,sr_legacy_food,"Beef, composite of trimmed retail cuts, separable lean only, trimmed to 1/8"" fat, select, raw",13,2019/4/1
171780,sr_legacy_food,"Beef, chuck, clod roast, separable lean only, trimmed to 1/4"" fat, all grades, cooked, roasted",13,2019/4/1
171781,sr_legacy_food,"Beef, shoulder steak, boneless, separable lean only, trimmed to 0"" fat, all grades, cooked, grilled",13,2019/4/1
171782,sr_legacy_food,"Beef, chuck, clod steak, separable lean only, trimmed to 1/4"" fat, all grades, cooked, braised",13,2019/4/1
171783,sr_legacy_food,"Beef, chuck, mock tender steak, separable lean and fat, trimmed to 0"" fat, USDA choice, cooked, broiled",13,2019/4/1
171784,sr_legacy_food,"Beef, chuck, clod roast, separable lean and fat, trimmed to 0"" fat, select, cooked, roasted",13,2019/4/1
171785,sr_legacy_food,"Beef, shoulder steak, boneless, separable lean and fat, trimmed to 0"" fat, choice, cooked, grilled",13,2019/4/1
171786,sr_legacy_food,"Beef, shoulder steak, boneless, separable lean and fat, trimmed to 0"" fat, select, cooked, grilled",13,2019/4/1
171787,sr_legacy_food,"Beef, plate, inside skirt steak, separable lean and fat, trimmed to 0"" fat, all grades, cooked, broiled",13,2019/4/1
171788,sr_legacy_food,"Beef, plate, outside skirt steak, separable lean and fat, trimmed to 0"" fat, all grades, cooked, broiled",13,2019/4/1
171789,sr_legacy_food,"Beef, shoulder steak, boneless, separable lean and fat, trimmed to 0"" fat, all grades, cooked, grilled",13,2019/4/1
171790,sr_legacy_food,"Beef, ground, 95% lean meat / 5% fat, raw",13,2019/4/1
171791,sr_legacy_food,"Beef, ground, 95% lean meat / 5% fat, patty, cooked, broiled",13,2019/4/1
171792,sr_legacy_food,"Beef, ground, 95% lean meat / 5% fat, patty, cooked, pan-broiled",13,2019/4/1
171793,sr_legacy_food,"Beef, ground, 90% lean meat / 10% fat, patty, cooked, pan-broiled",13,2019/4/1
171794,sr_legacy_food,"Beef, ground, 90% lean meat / 10% fat, crumbles, cooked, pan-browned",13,2019/4/1
171795,sr_legacy_food,"Beef, ground, 90% lean meat / 10% fat, loaf, cooked, baked",13,2019/4/1
171796,sr_legacy_food,"Beef, ground, 85% lean meat / 15% fat, raw (Includes foods for USDA's Food Distribution Program)",13,2019/4/1
171797,sr_legacy_food,"Beef, ground, 80% lean meat / 20% fat, patty, cooked, broiled",13,2019/4/1
171798,sr_legacy_food,"Beef, ground, 80% lean meat / 20% fat, patty, cooked, pan-broiled",13,2019/4/1
171799,sr_legacy_food,"Beef, ground, 80% lean meat / 20% fat, crumbles, cooked, pan-browned",13,2019/4/1
171800,sr_legacy_food,"Beef, ground, 80% lean meat / 20% fat, loaf, cooked, baked",13,2019/4/1
171801,sr_legacy_food,"Beef, ground, 75% lean meat / 25% fat, loaf, cooked, baked",13,2019/4/1
171802,sr_legacy_food,"Beef, rib, small end (ribs 10-12), separable lean only, trimmed to 1/8"" fat, select, raw",13,2019/4/1
171803,sr_legacy_food,"Beef, tenderloin, steak, separable lean only, trimmed to 1/8"" fat, select, raw",13,2019/4/1
171804,sr_legacy_food,"Beef, top sirloin, steak, separable lean only, trimmed to 1/8"" fat, select, raw",13,2019/4/1
171805,sr_legacy_food,"Beef, short loin, top loin, steak, separable lean only, trimmed to 1/8"" fat, select, cooked, grilled",13,2019/4/1
171806,sr_legacy_food,"Beef, round, bottom round , roast, separable lean only, trimmed to 1/8"" fat, select, cooked, roasted",13,2019/4/1
171807,sr_legacy_food,"Beef, round, eye of round, roast, separable lean only, trimmed to 1/8"" fat, select, cooked, roasted",13,2019/4/1
171808,sr_legacy_food,"Beef, round, top round, steak, separable lean only, trimmed to 1/8"" fat, select, cooked, broiled",13,2019/4/1
171809,sr_legacy_food,"Beef, round, eye of round, roast, separable lean only, trimmed to 1/8"" fat, all grades, cooked, roasted",13,2019/4/1
171810,sr_legacy_food,"Beef, rib, small end (ribs 10-12), separable lean only, trimmed to 1/8"" fat, all grades, raw",13,2019/4/1
