fdc_id,data_type,description,food_category_id,publication_date
169510,sr_legacy_food,"Beef, rib, small end (ribs 10-12), separable lean and fat, trimmed to 1/8"" fat, all grades, cooked, broiled",13,2019/4/1
169511,sr_legacy_food,"Beef, rib, small end (ribs 10-12), separable lean and fat, trimmed to 1/8"" fat, all grades, cooked, roasted",13,2019/4/1
169512,sr_legacy_food,"Beef, rib, small end (ribs 10-12), separable lean and fat, trimmed to 1/8"" fat, choice, raw",13,2019/4/1
169513,sr_legacy_food,"Beef, rib, small end (ribs 10-12), separable lean and fat, trimmed to 1/8"" fat, select, cooked, roasted",13,2019/4/1
169514,sr_legacy_food,"Beef, rib, small end (ribs 10-12), separable lean and fat, trimmed to 1/8"" fat, prime, raw",13,2019/4/1
169515,sr_legacy_food,"Beef, rib, small end (ribs 10-12), separable lean and fat, trimmed to 1/8"" fat, prime, cooked, broiled",13,2019/4/1
169516,sr_legacy_food,"Beef, rib, small end (ribs 10-12), separable lean and fat, trimmed to 1/8"" fat, prime, cooked, roasted",13,2019/4/1
169517,sr_legacy_food,"Beef, round, full cut, separable lean and fat, trimmed to 1/8"" fat, select, raw",13,2019/4/1
169518,sr_legacy_food,"Beef, round, full cut, separable lean and fat, trimmed to 1/8"" fat, select, cooked, broiled",13,2019/4/1
169519,sr_legacy_food,"Beef, round, bottom round, steak, separable lean and fat, trimmed to 1/8"" fat, all grades, raw",13,2019/4/1
169520,sr_legacy_food,"Beef, round, bottom round, steak, separable lean and fat, trimmed to 1/8"" fat, all grades, cooked, braised",13,2019/4/1
169521,sr_legacy_food,"Beef, round, bottom round, steak, separable lean and fat, trimmed to 1/8"" fat, select, cooked, braised",13,2019/4/1
169522,sr_legacy_food,"Beef, round, bottom round, roast, separable lean and fat, trimmed to 1/8"" fat, select, cooked, roasted",13,2019/4/1
169523,sr_legacy_food,"Beef, round, eye of round, roast, separable lean and fat, trimmed to 1/8"" fat, all grades, raw",13,2019/4/1
169524,sr_legacy_food,"Beef, round, eye of round, roast, separable lean and fat, trimmed to 1/8"" fat, all grades, cooked, roasted",13,2019/4/1
169525,sr_legacy_food,"Beef, round, tip round, separable lean and fat, trimmed to 1/8"" fat, all grades, raw",13,2019/4/1
169526,sr_legacy_food,"Beef, round, tip round, roast, separable lean and fat, trimmed to 1/8"" fat, all grades, cooked, roasted",13,2019/4/1
169527,sr_legacy_food,"Beef, round, tip round, separable lean and fat, trimmed to 1/8"" fat, choice, raw",13,2019/4/1
169528,sr_legacy_food,"Beef, round, tip round, roast, separable lean and fat, trimmed to 1/8"" fat, choice, cooked, roasted",13,2019/4/1
169529,sr_legacy_food,"Beef, round, top round, steak, separable lean and fat, trimmed to 1/8"" fat, all grades, raw",13,2019/4/1
169530,sr_legacy_food,"Beef, round, top round, separable lean and fat, trimmed to 1/8"" fat, all grades, cooked, braised",13,2019/4/1
169531,sr_legacy_food,"Beef, round, top round steak, separable lean and fat, trimmed to 1/8"" fat, all grades, cooked, broiled",13,2019/4/1
169532,sr_legacy_food,"Beef, round, top round, steak, separable lean and fat, trimmed to 1/8"" fat, choice, raw",13,2019/4/1
169533,sr_legacy_food,"Beef, round, top round, steak, separable lean and fat, trimmed to 1/8"" fat, select, cooked, broiled",13,2019/4/1
169534,sr_legacy_food,"Beef, round, top round, separable lean and fat, trimmed to 1/8"" fat, prime, raw",13,2019/4/1
169535,sr_legacy_food,"Beef, round, top round, steak, separable lean and fat, trimmed to 1/8"" fat, prime, cooked, broiled",13,2019/4/1
169536,sr_legacy_food,"Beef, shoulder top blade steak, boneless, separable lean and fat, trimmed to 0"" fat, select, raw",13,2019/4/1
169537,sr_legacy_food,"Beef, short loin, t-bone steak, separable lean and fat, trimmed to 1/8"" fat, choice, cooked, grilled",13,2019/4/1
169538,sr_legacy_food,"Beef, short loin, top loin, steak, separable lean and fat, trimmed to 1/8"" fat, all grades, raw",13,2019/4/1
169539,sr_legacy_food,"Beef, loin, top loin, separable lean and fat, trimmed to 1/8"" fat, all grades, cooked, grilled",13,2019/4/1
169540,sr_legacy_food,"Beef, loin, top loin, separable lean and fat, trimmed to 1/8"" fat, choice, raw",13,2019/4/1
169541,sr_legacy_food,"Beef, short loin, top loin, separable lean and fat, trimmed to 1/8"" fat, prime, cooked, broiled",13,2019/4/1
169542,sr_legacy_food,"Beef, tenderloin, steak, separable lean and fat, trimmed to 1/8"" fat, all grades, raw",13,2019/4/1
169543,sr_legacy_food,"Beef, tenderloin, steak, separable lean and fat, trimmed to 1/8"" fat, all grades, cooked, broiled",13,2019/4/1
169544,sr_legacy_food,"Beef, tenderloin, roast, separable lean and fat, trimmed to 1/8"" fat, all grades, cooked, roasted",13,2019/4/1
169545,sr_legacy_food,"Beef, tenderloin, steak, separable lean and fat, trimmed to 1/8"" fat, choice, raw",13,2019/4/1
169546,sr_legacy_food,"Beef, tenderloin, roast, separable lean and fat, trimmed to 1/8"" fat, select, cooked, roasted",13,2019/4/1
169547,sr_legacy_food,"Beef, tenderloin, separable lean and fat, trimmed to 1/8"" fat, prime, raw",13,2019/4/1
169548,sr_legacy_food,"Beef, tenderloin, steak, separable lean and fat, trimmed to 1/8"" fat, prime, cooked, broiled",13,2019/4/1
169549,sr_legacy_food,"Beef, tenderloin, roast, separable lean and fat, trimmed to 1/8"" fat, prime, cooked, roasted",13,2019/4/1
169550,sr_legacy_food,"Beef, top sirloin, steak, separable lean and fat, trimmed to 1/8"" fat, choice, cooked, pan-fried",13,2019/4/1
169551,sr_legacy_food,"Beef, top sirloin, steak, separable lean and fat, trimmed to 1/8"" fat, select, raw",13,2019/4/1
169552,sr_legacy_food,"Beef, top sirloin, steak, separable lean and fat, trimmed to 1/8"" fat, select, cooked, broiled",13,2019/4/1
169553,sr_legacy_food,"Beef, chuck, clod roast, separable lean only, trimmed to 0"" fat, choice, cooked, roasted",13,2019/4/1
169554,sr_legacy_food,"Beef, flank, steak, separable lean and fat, trimmed to 0"" fat, select, cooked, broiled",13,2019/4/1
169555,sr_legacy_food,"Beef, brisket, flat half, separable lean and fat, trimmed to 0"" fat, select, cooked, braised",13,2019/4/1
169556,sr_legacy_food,"Beef, rib eye, small end (ribs 10-12), separable lean and fat, trimmed to 0"" fat, select, cooked, broiled",13,2019/4/1
169557,sr_legacy_food,"Beef, rib eye, small end (ribs 10-12), separable lean and fat, trimmed to 0"" fat, all grades, cooked, broiled",13,2019/4/1
169558,sr_legacy_food,"Beef, bottom sirloin, tri-tip roast, separable lean and fat, trimmed to 0"" fat, all grades, cooked, roasted",13,2019/4/1
169559,sr_legacy_food,"Beef, bottom sirloin, tri-tip roast, separable lean and fat, trimmed to 0"" fat, select, raw",13,2019/4/1
169560,sr_legacy_food,"Beef, round, top round steak, boneless, separable lean and fat, trimmed to 0"" fat, all grades, cooked, grilled",13,2019/4/1
169561,sr_legacy_food,"Beef, chuck, mock tender steak, separable lean only, trimmed to 0"" fat, choice, cooked, broiled",13,2019/4/1
169562,sr_legacy_food,"Beef, chuck, mock tender steak, separable lean only, trimmed to 0"" fat, select, cooked, broiled",13,2019/4/1
169563,sr_legacy_food,"Beef, flank, steak, separable lean and fat, trimmed to 0"" fat, all grades, raw",13,2019/4/1
169564,sr_legacy_food,"Beef, flank, steak, separable lean and fat, trimmed to 0"" fat, select, raw",13,2019/4/1
169565,sr_legacy_food,"Beef, chuck eye roast, boneless, America's Beef Roast, separable lean only, trimmed to 0"" fat, all grades, raw",13,2019/4/1
169566,sr_legacy_food,"Beef, chuck eye roast, boneless, America's Beef Roast, separable lean only, trimmed to 0"" fat, choice, raw",13,2019/4/1
169567,sr_legacy_food,"Beef, chuck, short ribs, boneless, separable lean only, trimmed to 0"" fat, choice, cooked, braised",13,2019/4/1
169568,sr_legacy_food,"Beef, chuck, short ribs, boneless, separable lean only, trimmed to 0"" fat, select, cooked, braised",13,2019/4/1
169569,sr_legacy_food,"Beef, chuck, short ribs, boneless, separable lean only, trimmed to 0"" fat, all grades, cooked, braised",13,2019/4/1
169570,sr_legacy_food,"Beef, brisket, flat half, boneless, separable lean and fat, trimmed to 0"" fat, select, raw",13,2019/4/1
169571,sr_legacy_food,"Beef, loin, bottom sirloin butt, tri-tip roast, separable lean only, trimmed to 0"" fat, all grades, cooked, roasted",13,2019/4/1
169572,sr_legacy_food,"Alcoholic beverage, beer, light, BUD LIGHT",14,2019/4/1
169573,sr_legacy_food,"Alcoholic beverage, daiquiri, canned",14,2019/4/1
169574,sr_legacy_food,"Alcoholic beverage, daiquiri, prepared-from-recipe",14,2019/4/1
169575,sr_legacy_food,"Alcoholic beverage, beer, light, low carb",14,2019/4/1
169576,sr_legacy_food,"Candies, milk chocolate coated raisins",19,2019/4/1
169577,sr_legacy_food,"Syrups, table blends, pancake, reduced-calorie",19,2019/4/1
169578,sr_legacy_food,"Syrups, table blends, pancake",19,2019/4/1
169579,sr_legacy_food,"Candies, HERSHEY'S POT OF GOLD Almond Bar",19,2019/4/1
169580,sr_legacy_food,"Candies, truffles, prepared-from-recipe",19,2019/4/1
169581,sr_legacy_food,"Baking chocolate, MARS SNACKFOOD US, M&M's Semisweet Chocolate Mini Baking Bits",19,2019/4/1
169582,sr_legacy_food,"Candies, MARS SNACKFOOD US, M&M's Peanut Chocolate Candies",19,2019/4/1
169583,sr_legacy_food,"Candies, MARS SNACKFOOD US, M&M's Milk Chocolate Candies",19,2019/4/1
169584,sr_legacy_food,"Baking chocolate, MARS SNACKFOOD US, M&M's Milk Chocolate Mini Baking Bits",19,2019/4/1
169585,sr_legacy_food,"Candies, peanut bar",19,2019/4/1
169586,sr_legacy_food,"Candies, peanut brittle, prepared-from-recipe",19,2019/4/1
169587,sr_legacy_food,"Candies, NESTLE, RAISINETS Chocolate Covered Raisins",19,2019/4/1
169588,sr_legacy_food,"Candies, sesame crunch",19,2019/4/1
169589,sr_legacy_food,"Candies, MARS SNACKFOOD US, SNICKERS Bar",19,2019/4/1
169590,sr_legacy_food,"Candies, MARS SNACKFOOD US, STARBURST Fruit Chews, Original fruits",19,2019/4/1
169591,sr_legacy_food,"Candies, MARS SNACKFOOD US, M&M's MINIs Milk Chocolate Candies",19,2019/4/1
169592,sr_legacy_food,"Candies, SPECIAL DARK Chocolate Bar",19,2019/4/1
169593,sr_legacy_food,"Cocoa, dry powder, unsweetened",19,2019/4/1
169594,sr_legacy_food,"Cocoa, dry powder, unsweetened, processed with alkali",19,2019/4/1
169595,sr_legacy_food,"Desserts, egg custard, baked, prepared-from-recipe",19,2019/4/1
169596,sr_legacy_food,"Gelatin desserts, dry mix, prepared with water",19,2019/4/1
169597,sr_legacy_food,"Gelatin desserts, dry mix, reduced calorie, with aspartame",19,2019/4/1
169598,sr_legacy_food,"Gelatin desserts, dry mix, reduced calorie, with aspartame, prepared with water",19,2019/4/1
169599,sr_legacy_food,"Gelatins, dry powder, unsweetened",19,2019/4/1
169600,sr_legacy_food,"Puddings, chocolate, dry mix, instant, prepared with whole milk",19,2019/4/1
169601,sr_legacy_food,"Desserts, apple crisp, prepared-from-recipe",19,2019/4/1
169602,sr_legacy_food,"Flan, caramel custard, dry mix",19,2019/4/1
169603,sr_legacy_food,"Puddings, chocolate, dry mix, regular",19,2019/4/1
169604,sr_legacy_food,"Puddings, chocolate, dry mix, regular, prepared with whole milk",19,2019/4/1
169605,sr_legacy_food,"Puddings, rice, dry mix, prepared with whole milk",19,2019/4/1
169606,sr_legacy_food,"Puddings, tapioca, dry mix",19,2019/4/1
169607,sr_legacy_food,"Puddings, tapioca, dry mix, prepared with whole milk",19,2019/4/1
169608,sr_legacy_food,"Puddings, vanilla, ready-to-eat",19,2019/4/1
169609,sr_legacy_food,"Puddings, vanilla, dry mix, regular",19,2019/4/1
169610,sr_legacy_food,"Puddings, vanilla, dry mix, regular, prepared with whole milk",19,2019/4/1
169611,sr_legacy_food,"Puddings, rice, dry mix, prepared with 2% milk",19,2019/4/1
169612,sr_legacy_food,"Puddings, tapioca, dry mix, prepared with 2% milk",19,2019/4/1
169613,sr_legacy_food,"Frozen novelties, ice type, fruit, no sugar added",19,2019/4/1
169614,sr_legacy_food,"Puddings, tapioca, ready-to-eat",19,2019/4/1
169615,sr_legacy_food,"Puddings, coconut cream, dry mix, regular, prepared with 2% milk",19,2019/4/1
169616,sr_legacy_food,"Desserts, rennin, chocolate, dry mix",19,2019/4/1
169617,sr_legacy_food,"Rennin, chocolate, dry mix, prepared with whole milk",19,2019/4/1
169618,sr_legacy_food,"Frostings, coconut-nut, ready-to-eat",19,2019/4/1
169619,sr_legacy_food,"Frostings, cream cheese-flavor, ready-to-eat",19,2019/4/1
169620,sr_legacy_food,"Frostings, vanilla, creamy, ready-to-eat",19,2019/4/1
169621,sr_legacy_food,"Flan, caramel custard, dry mix, prepared with 2% milk",19,2019/4/1
169622,sr_legacy_food,"Candies, HERSHEY'S MILK CHOCOLATE WITH ALMOND BITES",19,2019/4/1
169623,sr_legacy_food,"Candies, REESE'S BITES",19,2019/4/1
169624,sr_legacy_food,"Candies, REESE'S NUTRAGEOUS Candy Bar",19,2019/4/1
169625,sr_legacy_food,"Frostings, chocolate, creamy, dry mix",19,2019/4/1
169626,sr_legacy_food,"Frostings, white, fluffy, dry mix, prepared with water",19,2019/4/1
169627,sr_legacy_food,"Candies, HERSHEY'S, ALMOND JOY BITES",19,2019/4/1
169628,sr_legacy_food,"Candies, HERSHEY, REESESTICKS crispy wafers, peanut butter, milk chocolate",19,2019/4/1
169629,sr_legacy_food,"Candies, HERSHEY, KIT KAT BIG KAT Bar",19,2019/4/1
169630,sr_legacy_food,"Candies, REESE'S, FAST BREAK, milk chocolate peanut butter and soft nougats",19,2019/4/1
169631,sr_legacy_food,"Ice creams, vanilla, light, no sugar added",19,2019/4/1
169632,sr_legacy_food,"Frozen novelties, fruit and juice bars",19,2019/4/1
169633,sr_legacy_food,"Ice creams, chocolate, light, no sugar added",19,2019/4/1
169634,sr_legacy_food,"Candies, dark chocolate coated coffee beans",19,2019/4/1
169635,sr_legacy_food,"Snacks, SUNKIST, SUNKIST Fruit Roll, strawberry, with vitamins A, C, and E",23,2019/4/1
169636,sr_legacy_food,"Snacks, fruit leather, pieces, with vitamin C",23,2019/4/1
169637,sr_legacy_food,"Candies, milk chocolate coated coffee beans",19,2019/4/1
169638,sr_legacy_food,"Frozen novelties, ice type, lime",19,2019/4/1
169639,sr_legacy_food,"Candies, MARS SNACKFOOD US, SNICKERS MUNCH bar",19,2019/4/1
169640,sr_legacy_food,Honey,19,2019/4/1
169641,sr_legacy_food,Jams and preserves,19,2019/4/1
169642,sr_legacy_food,Jellies,19,2019/4/1
169643,sr_legacy_food,"Candies, MARS SNACKFOOD US, POP'ABLES SNICKERS Brand Bite Size Candies",19,2019/4/1
169644,sr_legacy_food,"Candies, MARS SNACKFOOD US, POP'ABLES MILKY WAY Brand Bite Size Candies",19,2019/4/1
169645,sr_legacy_food,"Candies, MARS SNACKFOOD US, POP'ABLES 3 MUSKETEERS Brand Bite Size Candies",19,2019/4/1
169646,sr_legacy_food,"Candies, MARS SNACKFOOD US, STARBURST Fruit Chews, Fruit and Creme",19,2019/4/1
169647,sr_legacy_food,"Candies, MARS SNACKFOOD US, STARBURST Sour Fruit Chews",19,2019/4/1
169648,sr_legacy_food,"Puddings, banana, dry mix, instant",19,2019/4/1
169649,sr_legacy_food,"Puddings, banana, dry mix, instant, prepared with whole milk",19,2019/4/1
169650,sr_legacy_food,"Puddings, banana, dry mix, regular",19,2019/4/1
169651,sr_legacy_food,"Candies, MARS SNACKFOOD US, COCOAVIA Chocolate Bar",19,2019/4/1
169652,sr_legacy_food,"Candies, MARS SNACKFOOD US, COCOAVIA Blueberry and Almond Chocolate Bar",19,2019/4/1
169653,sr_legacy_food,"Candies, MARS SNACKFOOD US, COCOAVIA Crispy Chocolate Bar",19,2019/4/1
169654,sr_legacy_food,"Puddings, lemon, dry mix, instant",19,2019/4/1
169655,sr_legacy_food,"Sugars, granulated",19,2019/4/1
169656,sr_legacy_food,"Sugars, powdered",19,2019/4/1
169657,sr_legacy_food,"Sweeteners, tabletop, aspartame, EQUAL, packets",19,2019/4/1
169658,sr_legacy_food,"Sugars, maple",19,2019/4/1
169659,sr_legacy_food,"Syrups, corn, high-fructose",19,2019/4/1
169660,sr_legacy_food,"Syrups, malt",19,2019/4/1
169661,sr_legacy_food,"Syrups, maple",19,2019/4/1
169662,sr_legacy_food,"Syrups, sorghum",19,2019/4/1
169663,sr_legacy_food,"Candies, MARS SNACKFOOD US, SNICKERS CRUNCHER",19,2019/4/1
169664,sr_legacy_food,"Toppings, marshmallow cream",19,2019/4/1
169665,sr_legacy_food,"Toppings, pineapple",19,2019/4/1
169666,sr_legacy_food,"Toppings, nuts in syrup",19,2019/4/1
169667,sr_legacy_food,"Candies, MARS SNACKFOOD US, SKITTLES Tropical Bite Size Candies",19,2019/4/1
169668,sr_legacy_food,"Frostings, glaze, prepared-from-recipe",19,2019/4/1
169669,sr_legacy_food,"Candies, fudge, chocolate marshmallow, prepared-from-recipe",19,2019/4/1
169670,sr_legacy_food,"Candies, taffy, prepared-from-recipe",19,2019/4/1
169671,sr_legacy_food,"Candies, toffee, prepared-from-recipe",19,2019/4/1
169672,sr_legacy_food,"Snacks, cornnuts, barbecue-flavor",23,2019/4/1
169673,sr_legacy_food,"Snacks, crisped rice bar, almond",23,2019/4/1
169674,sr_legacy_food,"Snacks, granola bars, soft, uncoated, chocolate chip",23,2019/4/1
169675,sr_legacy_food,"Snacks, granola bars, soft, uncoated, chocolate chip, graham and marshmallow",23,2019/4/1
169676,sr_legacy_food,"Snacks, granola bars, soft, uncoated, nut and raisin",23,2019/4/1
169677,sr_legacy_food,"Snacks, potato chips, plain, salted",23,2019/4/1
169678,sr_legacy_food,"Snacks, potato chips, made from dried potatoes, cheese-flavor",23,2019/4/1
169679,sr_legacy_food,"Snacks, rice cakes, brown rice, corn",23,2019/4/1
169680,sr_legacy_food,"Snacks, rice cakes, brown rice, multigrain",23,2019/4/1
169681,sr_legacy_food,"Snacks, granola bars, hard, peanut butter",23,2019/4/1
169682,sr_legacy_food,"Snacks, potato chips, cheese-flavor",23,2019/4/1
169683,sr_legacy_food,"Snacks, potato chips, reduced fat",23,2019/4/1
169684,sr_legacy_food,"Snacks, potato chips, fat-free, made with olestra",23,2019/4/1
169685,sr_legacy_food,"Popcorn, sugar syrup/caramel, fat-free",23,2019/4/1
169686,sr_legacy_food,"Snacks, potato chips, fat free, salted",23,2019/4/1
169687,sr_legacy_food,"Snacks, KELLOGG, KELLOGG'S RICE KRISPIES TREATS Squares",23,2019/4/1
169688,sr_legacy_food,"Snacks, KELLOGG, KELLOGG'S Low Fat Granola Bar, Crunchy Almond/Brown Sugar",23,2019/4/1
169689,sr_legacy_food,"Snacks, M&M MARS, KUDOS Whole Grain Bar, chocolate chip",23,2019/4/1
169690,sr_legacy_food,"Candies, semisweet chocolate, made with butter",19,2019/4/1
169691,sr_legacy_food,"Gelatin desserts, dry mix, with added ascorbic acid, sodium-citrate and salt",19,2019/4/1
169692,sr_legacy_food,"Gelatin desserts, dry mix, reduced calorie, with aspartame, added phosphorus, potassium, sodium, vitamin C",19,2019/4/1
169693,sr_legacy_food,"Gelatin desserts, dry mix, reduced calorie, with aspartame, no added sodium",19,2019/4/1
169694,sr_legacy_food,"Corn flour, masa, enriched, white",20,2019/4/1
169695,sr_legacy_food,"Corn flour, yellow, degermed, unenriched",20,2019/4/1
169696,sr_legacy_food,"Corn flour, masa, unenriched, white",20,2019/4/1
169697,sr_legacy_food,"Cornmeal, whole-grain, yellow",20,2019/4/1
169698,sr_legacy_food,Cornstarch,20,2019/4/1
169699,sr_legacy_food,"Couscous, dry",20,2019/4/1
169700,sr_legacy_food,"Couscous, cooked",20,2019/4/1
169701,sr_legacy_food,"Hominy, canned, white",20,2019/4/1
169702,sr_legacy_food,"Millet, raw",20,2019/4/1
169703,sr_legacy_food,"Rice, brown, long-grain, raw (Includes foods for USDA's Food Distribution Program)",20,2019/4/1
169704,sr_legacy_food,"Rice, brown, long-grain, cooked (Includes foods for USDA's Food Distribution Program)",20,2019/4/1
169705,sr_legacy_food,Oats (Includes foods for USDA's Food Distribution Program),20,2019/4/1
169706,sr_legacy_food,"Rice, brown, medium-grain, raw (Includes foods for USDA's Food Distribution Program)",20,2019/4/1
169707,sr_legacy_food,"Rice, white, long-grain, parboiled, enriched, dry",20,2019/4/1
169708,sr_legacy_food,"Rice, white, long-grain, parboiled, enriched, cooked",20,2019/4/1
169709,sr_legacy_food,"Rice, white, long-grain, precooked or instant, enriched, dry",20,2019/4/1
169710,sr_legacy_food,"Rice, white, long-grain, precooked or instant, enriched, prepared",20,2019/4/1
169711,sr_legacy_food,"Rice, white, glutinous, unenriched, cooked",20,2019/4/1
169712,sr_legacy_food,"Rice, white, steamed, Chinese restaurant",20,2019/4/1
169713,sr_legacy_food,"Rice bran, crude",20,2019/4/1
169714,sr_legacy_food,"Rice flour, white, unenriched",20,2019/4/1
169715,sr_legacy_food,"Semolina, enriched",20,2019/4/1
169716,sr_legacy_food,Sorghum grain,20,2019/4/1
169717,sr_legacy_food,"Tapioca, pearl, dry",20,2019/4/1
169718,sr_legacy_food,Triticale,20,2019/4/1
169719,sr_legacy_food,"Wheat, hard white",20,2019/4/1
169720,sr_legacy_food,"Wheat, soft white",20,2019/4/1
169721,sr_legacy_food,"Wheat, durum",20,2019/4/1
169722,sr_legacy_food,"Wheat bran, crude",20,2019/4/1
169723,sr_legacy_food,"Wheat flour, white, cake, enriched",20,2019/4/1
169724,sr_legacy_food,"Wheat flour, white, tortilla mix, enriched",20,2019/4/1
169725,sr_legacy_food,"Wheat, sprouted",20,2019/4/1
169726,sr_legacy_food,"Wild rice, raw",20,2019/4/1
169727,sr_legacy_food,"Pasta, fresh-refrigerated, plain, as purchased",20,2019/4/1
169728,sr_legacy_food,"Pasta, fresh-refrigerated, plain, cooked",20,2019/4/1
169729,sr_legacy_food,"Pasta, fresh-refrigerated, spinach, as purchased",20,2019/4/1
169730,sr_legacy_food,"Pasta, fresh-refrigerated, spinach, cooked",20,2019/4/1
169731,sr_legacy_food,"Noodles, egg, dry, enriched",20,2019/4/1
169732,sr_legacy_food,"Noodles, egg, enriched, cooked",20,2019/4/1
169733,sr_legacy_food,"Noodles, egg, spinach, enriched, dry",20,2019/4/1
169734,sr_legacy_food,"Noodles, egg, spinach, enriched, cooked",20,2019/4/1
169735,sr_legacy_food,"Noodles, flat, crunchy, Chinese restaurant",20,2019/4/1
169736,sr_legacy_food,"Pasta, dry, enriched",20,2019/4/1
169737,sr_legacy_food,"Pasta, cooked, enriched, without added salt",20,2019/4/1
169738,sr_legacy_food,"Pasta, whole-wheat, dry (Includes foods for USDA's Food Distribution Program)",20,2019/4/1
169739,sr_legacy_food,Barley flour or meal,20,2019/4/1
169740,sr_legacy_food,Barley malt flour,20,2019/4/1
169741,sr_legacy_food,"Oat flour, partially debranned",20,2019/4/1
169742,sr_legacy_food,"Rice noodles, dry",20,2019/4/1
169743,sr_legacy_food,"Wheat, KAMUT khorasan, uncooked",20,2019/4/1
169744,sr_legacy_food,"Wheat, KAMUT khorasan, cooked",20,2019/4/1
169745,sr_legacy_food,"Spelt, uncooked",20,2019/4/1
169746,sr_legacy_food,"Spelt, cooked",20,2019/4/1
169747,sr_legacy_food,"Teff, uncooked",20,2019/4/1
169748,sr_legacy_food,"Corn flour, whole-grain, white",20,2019/4/1
169749,sr_legacy_food,"Corn flour, yellow, masa, enriched",20,2019/4/1
169750,sr_legacy_food,"Cornmeal, whole-grain, white",20,2019/4/1
169751,sr_legacy_food,"Pasta, cooked, enriched, with added salt",20,2019/4/1
169752,sr_legacy_food,"Hominy, canned, yellow",20,2019/4/1
169753,sr_legacy_food,"Rice, white, long-grain, regular, cooked, enriched, with salt",20,2019/4/1
169754,sr_legacy_food,"Wheat flour, white, all-purpose, enriched, calcium-fortified",20,2019/4/1
169755,sr_legacy_food,"Noodles, egg, dry, unenriched",20,2019/4/1
169756,sr_legacy_food,"Rice, white, long-grain, regular, raw, unenriched",20,2019/4/1
169757,sr_legacy_food,"Rice, white, long-grain, regular, unenriched, cooked without salt",20,2019/4/1
169758,sr_legacy_food,"Rice, white, long-grain, parboiled, unenriched, dry",20,2019/4/1
169759,sr_legacy_food,"Rice, white, long-grain, parboiled, unenriched, cooked",20,2019/4/1
169760,sr_legacy_food,"Rice, white, medium-grain, raw, unenriched",20,2019/4/1
169761,sr_legacy_food,"Wheat flour, white, all-purpose, unenriched",20,2019/4/1
169762,sr_legacy_food,"Noodles, egg, cooked, unenriched, with added salt",20,2019/4/1
169763,sr_legacy_food,"Potatoes, yellow fleshed, roasted, salt added in processing, frozen, unprepared",11,2019/4/1
169764,sr_legacy_food,"Potatoes, yellow fleshed, french fried, frozen, unprepared",11,2019/4/1
169765,sr_legacy_food,"Ginger root, pickled, canned, with artificial sweetener",11,2019/4/1
169766,sr_legacy_food,"Peppers, hot pickled, canned",11,2019/4/1
169767,sr_legacy_food,"Vegetable juice, BOLTHOUSE FARMS, DAILY GREENS",11,2019/4/1
169768,sr_legacy_food,"Potatoes, mashed, ready-to-eat",11,2019/4/1
169769,sr_legacy_food,"Macaroni and cheese, box mix with cheese sauce, unprepared",22,2019/4/1
169770,sr_legacy_food,"Macaroni and cheese, box mix with cheese sauce, prepared",22,2019/4/1
169771,sr_legacy_food,"Taquitos, frozen, chicken and cheese, oven-heated",22,2019/4/1
169772,sr_legacy_food,"Taquitos, frozen, beef and cheese, oven-heated",22,2019/4/1
169773,sr_legacy_food,"Potsticker or wonton, pork and vegetable, frozen, unprepared",22,2019/4/1
169774,sr_legacy_food,"Macaroni or noodles with cheese, made from reduced fat packaged mix, unprepared",22,2019/4/1
169775,sr_legacy_food,"Turnover, cheese-filled, tomato-based sauce, frozen, unprepared",22,2019/4/1
169776,sr_legacy_food,"Macaroni or noodles with cheese, microwaveable, unprepared",22,2019/4/1
169777,sr_legacy_food,"Spanish rice mix, dry mix, prepared (with canola/vegetable oil blend or diced tomatoes and margarine)",22,2019/4/1
169778,sr_legacy_food,"Rice mix, cheese flavor, dry mix, unprepared",22,2019/4/1
169779,sr_legacy_food,"Dumpling, potato- or cheese-filled, frozen",22,2019/4/1
169780,sr_legacy_food,"Turnover, chicken- or turkey-, and vegetable-filled, reduced fat, frozen",22,2019/4/1
169781,sr_legacy_food,"Sausage, egg and cheese breakfast biscuit",22,2019/4/1
169782,sr_legacy_food,"HUNGRY MAN, Salisbury Steak With Gravy, frozen, unprepared",22,2019/4/1
169783,sr_legacy_food,"BANQUET, Salisbury Steak With Gravy, family size, frozen, unprepared",22,2019/4/1
169784,sr_legacy_food,"JIMMY DEAN, Sausage, Egg, and Cheese Breakfast Biscuit, frozen, unprepared",22,2019/4/1
169785,sr_legacy_food,"Infant formula, GERBER, GOOD START, PROTECT PLUS, powder",3,2019/4/1
169786,sr_legacy_food,"Infant Formula, GERBER GOOD START 2, GENTLE PLUS, powder",3,2019/4/1
169787,sr_legacy_food,"Infant formula, GERBER, GOOD START 2, PROTECT PLUS, powder",3,2019/4/1
169788,sr_legacy_food,"Infant formula, MEAD JOHNSON, ENFAMIL, ENFAGROW, Soy, Toddler transitions, with ARA and DHA,  powder",3,2019/4/1
169789,sr_legacy_food,"Infant formula, MEAD JOHNSON, ENFAMIL, Premature, 24 calories ready-to-feed Low iron",3,2019/4/1
169790,sr_legacy_food,"Infant Formula, MEAD JOHNSON, ENFAMIL, Premium, Infant, ready-to-feed",3,2019/4/1
